{
  "acceptance_criteria_id": "crit_123",
  "acceptance_type": "test_suite",
  "verification_method": "deterministic",
  "evidence_required": [
    "repo_commit_hash",
    "test_log",
    "runtime_hash"
  ],
  "auto_release_threshold": "all_tests_pass",
  "schema_or_test_ref": "content_addressed_schema_or_test_ref",
  "created_at": "2026-07-05T00:00:00Z"
}
